{
  "schema_version": 1,
  "date": "2026-10-06",
  "discovery_coverage": {
    "fill_ladder_exhausted": true,
    "backlog_checked": true,
    "backlog_remaining_eligible": 0,
    "targeted_refill_performed": true,
    "quality_first_confirmed": true,
    "windows": {
      "24h": {
        "status": "exhausted",
        "candidates_found": 4
      },
      "7d": {
        "status": "exhausted",
        "candidates_found": 7
      },
      "30d": {
        "status": "exhausted",
        "candidates_found": 2
      },
      "6m": {
        "status": "exhausted",
        "candidates_found": 5
      },
      "evergreen": {
        "status": "exhausted",
        "candidates_found": 50
      }
    },
    "category_candidates": {
      "ai-generation": {
        "candidates_considered": 0
      },
      "3d-production": {
        "candidates_considered": 2
      },
      "3d-animation": {
        "candidates_considered": 1
      },
      "engine-art": {
        "candidates_considered": 2
      },
      "emerging-case": {
        "candidates_considered": 0
      },
      "blender-dcc": {
        "candidates_considered": 14
      }
    },
    "registered_source_probe": {
      "performed": true,
      "initial_selected": [
        "80-level",
        "cg-channel",
        "blender-official",
        "epic-developer-community",
        "unity-official",
        "sidefx-official",
        "autodesk-area",
        "adobe-substance-3d",
        "game-developer"
      ],
      "refill_selected": [
        "3dnchu",
        "cgworld-jp",
        "bilibili-mobile",
        "artstation"
      ],
      "refill_batches": 2,
      "pre_refill_survivors": 13,
      "post_refill_survivors": 19,
      "sources": {
        "80-level": {
          "status": "checked",
          "method": "latest-index",
          "candidates_found": 7,
          "candidate_ids": [
            "80-level-artist-explores-realistic-water-adhesion-on-animated-charact",
            "80-level-merging-space-colonization-solver-with-pyro-simulation-to-cr",
            "80-level-artist-recreates-lifelike-bubble-physics-in-houdini-based-on",
            "80-level-blender-5-3-is-getting-native-3d-gaussian-splat-support",
            "80-level-hypnotizing-fluid-simulation-based-on-w-t-s-research-on-lagr",
            "80-level-stunning-forest-stream-simulation-made-with-houdini",
            "80-level-3d-artist-turned-wristwatch-into-m-bius-strip-using-houdini"
          ],
          "index_pages_checked": 2,
          "feed_urls_checked": 0,
          "refill_links_checked": 16,
          "semantic_expansion_links_checked": 1,
          "selection_phase": "daily-plan"
        },
        "3dnchu": {
          "status": "checked",
          "method": "latest-index",
          "candidates_found": 12,
          "candidate_ids": [
            "3dnchu-harmoflow",
            "3dnchu-sculpt-mesh-1-0",
            "3dnchu-unimate",
            "3dnchu-alpaca3d",
            "3dnchu-deeppaintclassjpn-gaku-2026-2",
            "3dnchu-full-control-lattice-generator-v1-0",
            "3dnchu-fx-maker-tools",
            "3dnchu-g-scatter-beta",
            "3dnchu-unreal-engine-shader-book-posita33",
            "3dnchu-virtucamera-2",
            "3dnchu-animation-nodes-blender",
            "3dnchu-samus-free-rig"
          ],
          "index_pages_checked": 1,
          "feed_urls_checked": 2,
          "refill_links_checked": 16,
          "semantic_expansion_links_checked": 3,
          "selection_phase": "targeted-refill"
        },
        "cgworld-jp": {
          "status": "checked",
          "method": "latest-index",
          "candidates_found": 1,
          "candidate_ids": [
            "cgworld-jp-substance-3d-painter"
          ],
          "index_pages_checked": 2,
          "feed_urls_checked": 0,
          "refill_links_checked": 1,
          "semantic_expansion_links_checked": 0,
          "selection_phase": "targeted-refill"
        },
        "bilibili-mobile": {
          "status": "checked",
          "method": "latest-index",
          "candidates_found": 0,
          "candidate_ids": [],
          "index_pages_checked": 1,
          "feed_urls_checked": 0,
          "refill_links_checked": 0,
          "semantic_expansion_links_checked": 0,
          "selection_phase": "targeted-refill"
        },
        "artstation": {
          "status": "blocked",
          "method": "latest-index",
          "candidates_found": 0,
          "candidate_ids": [],
          "reason": "http-403",
          "index_pages_checked": 0,
          "feed_urls_checked": 0,
          "refill_links_checked": 0,
          "selection_phase": "targeted-refill"
        },
        "gumroad-discover": {
          "status": "not-scheduled",
          "method": "rolling-window",
          "candidates_found": 0,
          "candidate_ids": [],
          "reason": "deterministic-rolling-probe-not-selected"
        },
        "xiaohongshu": {
          "status": "not-scheduled",
          "method": "rolling-window",
          "candidates_found": 0,
          "candidate_ids": [],
          "reason": "deterministic-rolling-probe-not-selected"
        },
        "cg-channel": {
          "status": "checked",
          "method": "latest-index",
          "candidates_found": 36,
          "candidate_ids": [
            "cg-channel-alexey-vanzhula-releases-modeler-26-for-houdini",
            "cg-channel-see-rodeo-fxs-vfx-breakdown-of-its-new-ad-for-fm-insurance",
            "cg-channel-see-how-framestore-created-a-cg-battlefield-for-lioness-seas",
            "cg-channel-see-monkey-rave-productions-vfx-breakdown-for-in-the-hand-of",
            "cg-channel-check-out-koala-fxs-vertiginous-vfx-breakdown-for-fall-2",
            "cg-channel-gravity-sketch-releases-gravity-sketch-vr-in-beta",
            "cg-channel-faceware-technologies-launches-faceware-studio",
            "cg-channel-discover-5-key-features-for-cg-artists-in-godot-4-6",
            "cg-channel-10-things-cg-artists-need-to-know-about-unreal-engine-6",
            "cg-channel-see-5-key-features-for-cg-artists-in-unreal-engine-5-8",
            "cg-channel-try-the-open-beta-of-rtx-render-for-character-creator-and-ic",
            "cg-channel-get-free-vfx-image-viewer-and-video-playback-tool-djv-3-6",
            "cg-channel-playcanvas-releases-supersplat-editor-3-0",
            "cg-channel-free-tutorial-design-mechs-in-vr-using-substance-3d-modeler",
            "cg-channel-alexey-vanzula-releases-direct-modeling-for-houdini",
            "cg-channel-itoosoft-releases-railclone-7",
            "cg-channel-blender-4-5-lts-is-out-check-out-its-5-key-features",
            "cg-channel-see-the-2026-blender-development-roadmap",
            "cg-channel-autodesk-releases-maya-2027-and-maya-creative-2027",
            "cg-channel-sidefx-just-released-houdini-22",
            "cg-channel-armorpaint-1-0-is-out-after-eight-years-in-early-access",
            "cg-channel-maxon-releases-cinema-4d-2026-4-with-a-new-mcp-server",
            "cg-channel-insydium-releases-nexus-2026-1-in-beta",
            "cg-channel-new-3d-software-you-may-have-missed-4-october-2026",
            "cg-channel-rokoko-studio-2-4-now-does-retargeting",
            "cg-channel-reallusions-3d-character-contest-returns-for-2026-with-45000",
            "cg-channel-armature-is-a-free-ai-assisted-standalone-character-rigging",
            "cg-channel-how-dupp-film-created-a-hybrid-cg-mermaid-for-summer-of-1985",
            "cg-channel-download-130-free-fbx-mocap-moves-from-anderson-rohr",
            "cg-channel-the-pixel-farm-lifts-feature-restrictions-on-pftrack-solo",
            "cg-channel-3d-io-releases-exr-io-2-0-for-photoshop",
            "cg-channel-baga-river-generator-lets-you-draw-rivers-into-blender-scene",
            "cg-channel-blender-5-0-is-out-check-out-its-5-key-features",
            "cg-channel-discover-5-key-features-in-blender-5-1",
            "cg-channel-blender-5-2-lts-is-here-discover-its-5-key-features",
            "cg-channel-check-out-free-maya-animation-productivity-toolset-keyflow"
          ],
          "index_pages_checked": 4,
          "feed_urls_checked": 2,
          "refill_links_checked": 16,
          "semantic_expansion_links_checked": 4,
          "selection_phase": "daily-plan"
        },
        "blender-official": {
          "status": "checked",
          "method": "latest-index",
          "candidates_found": 12,
          "candidate_ids": [
            "blender-official-blender-5-1-release",
            "blender-official-blender-5-2-lts-release",
            "blender-official-2d-isnt-dead-it-just-became-something-different-using-blende",
            "blender-official-cycles-texture-cache",
            "blender-official-the-future-of-storyboarding-blender-for-pre-production",
            "blender-official-animation-2025-progress-planning",
            "blender-official-blender-lab-activity-report-q1-2026",
            "blender-official-user-stories",
            "blender-official-cosmology-with-geometry-nodes",
            "blender-official-sinking-feeling-using-blender-to-do-good",
            "blender-official-using-blender-in-game-development-by-embark",
            "blender-official-visual-effects-for-the-indian-blockbuster-rrr"
          ],
          "index_pages_checked": 5,
          "feed_urls_checked": 1,
          "refill_links_checked": 16,
          "semantic_expansion_links_checked": 5,
          "selection_phase": "daily-plan"
        },
        "epic-developer-community": {
          "status": "checked",
          "method": "latest-index",
          "candidates_found": 0,
          "candidate_ids": [],
          "index_pages_checked": 1,
          "feed_urls_checked": 0,
          "refill_links_checked": 0,
          "semantic_expansion_links_checked": 0,
          "selection_phase": "daily-plan"
        },
        "unity-official": {
          "status": "checked",